{"adapter":{"id":"ordered-map-rust-json-adapter","version":"0.1.0"},"applicability":{"parameters":{"exitTimeoutSeconds":0.2,"keyDomain":["A","a","B","b","C","c"],"maximumHistory":3,"maximumLiveClasses":3,"observationLimit":3,"responseTimeoutSeconds":0.2,"valueMaximum":2,"valueMinimum":-2},"profiles":[{"id":"ordered-map-ascii-fold","kind":"realizationProfile","version":"0.1.0"}]},"assumptions":["The adapter faithfully exposes the named Realization.","The runner and O-R6d6 review correctly enforce the recorded checks."],"claim":{"id":"ordered-map-rust-put-existing-position","kind":"claim","version":"0.1.0"},"environment":{"gcc":"15.2.0","jsonschema":"4.26.0","python":"3.14.6","referencing":"0.37.0","runnerProtocol":"ordered-map-runner-json-v1","rustc":"1.96.1 (31fca3adb)"},"exclusions":["Support is bounded to the exact plan, profile, report, and process session.","No performance, malformed-client, concurrency, remote, or interoperation conclusion."],"freshness":{"producedAt":"2026-07-19T21:11:33Z"},"id":"ordered-map-rust-put-existing-position-conformance","kind":"evidence","mechanism":"bounded-conformance-campaign","method":"O-R6d6-reviewed OrderedMap campaign report for one declaration under the exact plan.","provenance":{"binarySha256":"ae457dde79c86091ff79b4603cf436f8d1c06b67affe4511ed089ecc86cb8a2a","commandsCanonicalSha256":"edd984454628c2697f6b3fe77fefe018cfcc99ceef3db5a1f31faf756283148e","declaration":"put-existing-position","declarationOutcome":{"causes":[],"id":"put-existing-position","observationCount":1,"result":"supports"},"harness":[{"path":"semantic_packages/__init__.py","sha256":"ae06adf5d023d88f6380400bd771f3f849934b945c19aff9eb5c5baae7dfd48f"},{"path":"semantic_packages/ordered_map_contract.py","sha256":"60f6c0d01faa544516dddaa7b91e1277a87b7b3aa92d8d5491792164547c7766"},{"path":"semantic_packages/canonical_artifact.py","sha256":"de90cf40f0070b360cf7c149cf6880b29a0d1c32b3f0767e610c68787d2c4144"},{"path":"scripts/record_check.py","sha256":"721c590057f568495a20b58adf39c08d25dddeaa896c4f3f825e5a5719a46edd"},{"path":"schemas/ordered-map-conformance-plan.schema.json","sha256":"d9e61cad21524a13312b86782967e5f14c46bed0c5a0b0888aaa3ea4174289d1"}],"outcomeCanonicalSha256":"c424e9de667971eb37ec164423306d2747d5cba68bea17e5cf2b1a2a7c77690d","plan":{"canonicalSha256":"2cf7b481946ce1c0130e70b0d0ffcc1ec5a58bb10e7963b3f5058253bb63447a","path":"contracts/ordered-map/conformance-plan.json","rawSha256":"bfffbe98114c78c04865bccadc143a02cd46beff71c0f04c0b7f5b522d15c1d3"},"profile":{"path":"registry/ordered-map/theory/dependencies/ordered-map-profile.json","sha256":"6d1297892c355a569e244c2b94448a5f5edaf9b1bf2ae54f940d7c4494fe225f"},"report":{"path":"reports/ordered-map/rust-campaign-report.json","sha256":"00f2d560d7a73237162fce706cd91372a2e822b51c62a4bae5b564d8a7f8d40b"},"reportCandidate":"ordered-map-rust","reportPacketRole":"candidate","review":"O-R6d6 PASS; retained report fact independently reproduced three consecutive times.","runner":{"path":"semantic_packages/ordered_map_runner.py","sha256":"9b4729ef5b879821e19926e85c0e4a9db18c81a94e2c28e9215ea28d8b24f28b"},"sources":[{"path":"implementations/ordered-map/rust/src/main.rs","sha256":"80c4d154ba753bf4cc2580aedc91a6eb9bded2da28318d1c63c2b76bf8eb1fc1"},{"path":"implementations/ordered-map/rust/src/ordered_map.rs","sha256":"5d81fde8a1695c1b1ce38b0dbef81da36376e5caffad20f7175b9469e8727012"}],"specification":{"path":"registry/ordered-map/theory/records/ordered-map-spec.json","sha256":"6049d371603cbdac0e722685f1fd25c7369872f7d963ae2e4f4bae90cce7fd7f"},"toolchainCanonicalSha256":"04652ccde9589ce5318a111d28e31dda63c77f22b5b7bda4edee944ceec37ec6"},"realization":{"id":"ordered-map-rust","kind":"realization","version":"0.1.0"},"result":"supports","reviewState":"accepted","scope":"realization","specification":{"id":"ordered-map","kind":"specification","version":"0.1.0"},"version":"0.1.0"}
