{
  "kind": "evidence",
  "id": "stack-pop-empty-proof",
  "version": "0.1.0",
  "claim": {
    "kind": "claim",
    "id": "stack-pop-empty-law",
    "version": "0.1.0"
  },
  "specification": {
    "kind": "specification",
    "id": "stack",
    "version": "0.1.0"
  },
  "scope": "specification",
  "mechanism": "proof",
  "result": "supports",
  "reviewState": "accepted",
  "method": "bounded proof fixture",
  "environment": {
    "checker": "fixture-only"
  },
  "freshness": {
    "producedAt": "2026-07-18T00:00:00Z"
  },
  "assumptions": ["The proof kernel is outside the Wave 2 fixture scope."],
  "exclusions": ["This evidence does not execute or scope a realization."],
  "applicability": {
    "profiles": []
  },
  "provenance": {
    "artifact": "fixture:pop-empty-proof"
  }
}
