{"adapter":{"id":"ordered-map-rust-json-adapter","version":"0.1.0"},"applicability":{"parameters":{"exitTimeoutSeconds":0.2,"keyDomain":["A","a","B","b","C","c"],"maximumHistory":3,"maximumLiveClasses":3,"observationLimit":3,"responseTimeoutSeconds":0.2,"valueMaximum":2,"valueMinimum":-2},"profiles":[{"id":"ordered-map-native-process","kind":"realizationProfile","version":"0.1.0"}]},"assumptions":["The adapter faithfully exposes the named Realization.","The runner and P-R3a review correctly enforce the recorded checks."],"claim":{"id":"ordered-map-rust-lookup-put-same","kind":"claim","version":"0.2.0"},"environment":{"gcc":"15.2.0","jsonschema":"4.26.0","python":"3.14.6","referencing":"0.37.0","runnerProtocol":"ordered-map-runner-json-v1","rustc":"1.96.1 (31fca3adb)"},"exclusions":["Support is bounded to the exact plan, profile, report, and process session.","No performance, malformed-client, concurrency, remote, or interoperation conclusion."],"freshness":{"producedAt":"2026-07-22T00:00:00Z"},"id":"ordered-map-rust-lookup-put-same-conformance","kind":"evidence","mechanism":"bounded-conformance-campaign","method":"P-R3a-reviewed OrderedMap campaign report for one declaration under the exact plan.","provenance":{"binarySha256":"ae457dde79c86091ff79b4603cf436f8d1c06b67affe4511ed089ecc86cb8a2a","commandsCanonicalSha256":"19cdcefcc97aa7b1d8bb0914d8ce28cdf03ee1a8bfa2c1ec0d1cba29a452cf8a","declaration":"lookup-put-same","declarationOutcome":{"causes":[],"id":"lookup-put-same","observationCount":2,"result":"supports"},"harness":[{"path":"semantic_packages/__init__.py","sha256":"ae06adf5d023d88f6380400bd771f3f849934b945c19aff9eb5c5baae7dfd48f"},{"path":"semantic_packages/ordered_map_contract.py","sha256":"60f6c0d01faa544516dddaa7b91e1277a87b7b3aa92d8d5491792164547c7766"},{"path":"semantic_packages/canonical_artifact.py","sha256":"de90cf40f0070b360cf7c149cf6880b29a0d1c32b3f0767e610c68787d2c4144"},{"path":"scripts/record_check.py","sha256":"721c590057f568495a20b58adf39c08d25dddeaa896c4f3f825e5a5719a46edd"},{"path":"scripts/ordered_map_report_check.py","sha256":"1fc0f2b22db7c9a04388cd078ac6f28d8c473c7fcad8c7a9b64f14ca03c8c8da"},{"path":"scripts/ordered_map_profile_choice_report_check.py","sha256":"3d502c52371917a90dbad92ff9315eedd244583e3155ede5a677697f8580575a"},{"path":"schemas/ordered-map-conformance-plan.schema.json","sha256":"d9e61cad21524a13312b86782967e5f14c46bed0c5a0b0888aaa3ea4174289d1"}],"outcomeCanonicalSha256":"48b6d950b7f35e3cda3870171d2028dbee92ea808fb5e3106edd3b46c64658b9","plan":{"canonicalSha256":"8cd414cf900f571994e081788cebf5f5c7c73964efd43f7384c2089b1fb0b472","path":"contracts/ordered-map/profile-choice/native-conformance-plan.json","rawSha256":"4ad983583dc4558c9321d3c2b7a8089f7f41aa25e391b5ffeac5875a9a28d932"},"profile":{"path":"registry/ordered-map/profile-choice/profiles/records/ordered-map-native-process.json","sha256":"788481758572ec2d94d3e97b009b9ca30e0322d07b93dcb37b6417243fffc450"},"report":{"path":"reports/ordered-map/profile-choice/rust-native-campaign-report.json","sha256":"4cc41ec214054bb0d6174e821fb80678ee8ad8fe72cac362fd01c0e91497bb5c"},"reportCandidate":"ordered-map-rust","reportPacketRole":"profile-choice-candidate","review":"P-R3a PASS; P-R3b record review pending.","runner":{"path":"semantic_packages/ordered_map_runner.py","sha256":"9b4729ef5b879821e19926e85c0e4a9db18c81a94e2c28e9215ea28d8b24f28b"},"sources":[{"path":"implementations/ordered-map/rust/src/main.rs","sha256":"80c4d154ba753bf4cc2580aedc91a6eb9bded2da28318d1c63c2b76bf8eb1fc1"},{"path":"implementations/ordered-map/rust/src/ordered_map.rs","sha256":"5d81fde8a1695c1b1ce38b0dbef81da36376e5caffad20f7175b9469e8727012"}],"specification":{"path":"registry/ordered-map/theory/records/ordered-map-spec.json","sha256":"6049d371603cbdac0e722685f1fd25c7369872f7d963ae2e4f4bae90cce7fd7f"},"toolchainCanonicalSha256":"04652ccde9589ce5318a111d28e31dda63c77f22b5b7bda4edee944ceec37ec6"},"realization":{"id":"ordered-map-rust","kind":"realization","version":"0.2.0"},"result":"supports","reviewState":"pending","scope":"realization","specification":{"id":"ordered-map","kind":"specification","version":"0.1.0"},"version":"0.2.0"}
