{
  "kind": "evidence",
  "id": "profile-order-evidence",
  "version": "0.1.0",
  "claim": { "kind": "claim", "id": "profile-order-claim", "version": "0.1.0" },
  "specification": { "kind": "specification", "id": "profile-order-stack", "version": "0.1.0" },
  "scope": "realization",
  "realization": { "kind": "realization", "id": "profile-order-realization", "version": "0.1.0" },
  "adapter": { "id": "adapter", "version": "0.1.0" },
  "mechanism": "property-test",
  "result": "supports",
  "reviewState": "accepted",
  "method": "profile set-order control",
  "environment": {},
  "freshness": { "producedAt": "2026-07-18T00:00:00Z" },
  "assumptions": [],
  "exclusions": [],
  "applicability": {
    "profiles": [
      { "kind": "realizationProfile", "id": "profile-b", "version": "0.1.0" },
      { "kind": "realizationProfile", "id": "profile-a", "version": "0.1.0" }
    ]
  },
  "provenance": {}
}
