{
  "kind": "evidence",
  "id": "stack-rust-persistence-conformance",
  "version": "0.1.0",
  "claim": {
    "kind": "claim",
    "id": "stack-rust-persistence",
    "version": "0.1.0"
  },
  "specification": {
    "kind": "specification",
    "id": "stack",
    "version": "0.1.0"
  },
  "scope": "realization",
  "realization": {
    "kind": "realization",
    "id": "stack-rust",
    "version": "0.1.0"
  },
  "adapter": {
    "id": "stack-rust-json-adapter",
    "version": "0.1.0"
  },
  "mechanism": "bounded-conformance-campaign",
  "result": "supports",
  "reviewState": "accepted",
  "method": "Retained-handle and ancestor campaign plus novel persistence review.",
  "environment": {
    "runner": "stack-runner-json-v1",
    "python": "3.14.6",
    "rustc": "1.96.1 (31fca3adb)",
    "linker": "GCC 15.2.0"
  },
  "freshness": {
    "producedAt": "2026-07-18T13:00:00Z"
  },
  "assumptions": [
    "The adapter faithfully exposes the named Realization.",
    "The runner and independent review correctly enforce the recorded checks."
  ],
  "exclusions": [
    "Support is bounded to the exact plan and one process session.",
    "No post-termination, performance, concurrency, remote, or interoperation conclusion."
  ],
  "applicability": {
    "profiles": [
      {
        "kind": "realizationProfile",
        "id": "stack-default",
        "version": "0.1.0"
      }
    ],
    "parameters": {
      "maximumDepth": 8,
      "maximumHistory": 32,
      "observationLimit": 9
    }
  },
  "provenance": {
    "declaration": "persistence",
    "planSha256": "e055eab406683a01a32e8b563ef2e299169ddb2745685b5ad3ffae3297d93f6c",
    "buildArgv": ["$RUSTC", "--edition", "2024", "-C", "linker=$CC", "implementations/rust/src/main.rs", "-o", "$RUST_BINARY"],
    "campaignArgv": ["$RUST_BINARY"],
    "inputs": {
      "specification": {"path": "fixtures/records/valid/stack-spec.json", "sha256": "dd083a71a4631cc44be051a16b8e20ff0cee7199e46d3823322665d1fdeec6c1"},
      "profile": {"path": "fixtures/records/valid/stack-profile.json", "sha256": "2a51ed7d2e1266376cd4a58ef3f20d30244655d25cb884816576be989014eddb"},
      "candidateMatrix": {"path": "tests/candidates/test_cross_language_candidates.py", "sha256": "7ce3b1c832810d549e1161ad988d3716e6eef304f1b8b1e508f95cf4e6feff43"},
      "breakerMain": {"path": "fixtures/candidates/wave4/rust_law_breaker/src/main.rs", "sha256": "e9503c8631df06e65715054aff7dcf9a120225197dd8c9ad586a4e7ab0f90316"},
      "breakerStack": {"path": "fixtures/candidates/wave4/rust_law_breaker/src/stack.rs", "sha256": "c5637b1454d558198cd3ef32978cc9ee9a6f2aa45c2b1f79747e8b1fd4ab0b92"}
    },
    "report": {
      "path": "evidence/wave4/rust-campaign-report.json",
      "sha256": "52eb94dc22c10267af1b50e1c4db130426b4d08e4b5bdc566a27efe8fb4d33fc"
    },
    "runner": {
      "path": "semantic_packages/stack_runner.py",
      "sha256": "50ec63e52c9f943cfe1f35f0463b1b4135c9abead19885af8e9629ccc7e031e1"
    },
    "sources": {
      "main": "2271800576b2d9eb59a74e8831314758eb964a31bbd05885f70654ffae8ae970",
      "stack": "5c09a1d1c0e58d361b4b3c35be1fce9469446045c9f6f3689e69a5115e2505c2"
    },
    "binarySha256": "55f234bd35917a5b937805d8dc0255d7485bf899dac4350fc1f35d1e723a61ec",
    "review": "W4-RR2 PASS; retained ancestor probes passed"
  }
}
