{"adapter":{"id":"ordered-map-typescript-json-adapter","version":"0.1.0"},"applicability":{"parameters":{"exitTimeoutSeconds":0.2,"keyDomain":["A","a","B","b","C","c"],"maximumHistory":3,"maximumLiveClasses":3,"observationLimit":3,"responseTimeoutSeconds":0.2,"valueMaximum":2,"valueMinimum":-2},"profiles":[{"id":"ordered-map-ascii-fold","kind":"realizationProfile","version":"0.1.0"}]},"assumptions":["Reported events are complete for the adapter-observed boundary.","The runner and O-R6d6 review correctly enforce the recorded checks."],"claim":{"id":"ordered-map-typescript-ordered-map-effects","kind":"claim","version":"0.1.0"},"environment":{"deno":"2.9.2","jsonschema":"4.26.0","python":"3.14.6","referencing":"0.37.0","runnerProtocol":"ordered-map-runner-json-v1","typescript":"6.0.3","v8":"14.9.207.2-rusty"},"exclusions":["Effects outside the adapter-reported invocation boundary are not observed.","No general external-effect, performance, concurrency, remote, or interoperation conclusion."],"freshness":{"producedAt":"2026-07-19T21:11:33Z"},"id":"ordered-map-typescript-ordered-map-effects-conformance","kind":"evidence","mechanism":"bounded-conformance-campaign","method":"O-R6d6-reviewed adapter-reported invocation-event campaign for one declaration under the exact plan.","provenance":{"binarySha256":null,"commandsCanonicalSha256":"b5ba107893120fdf77423cfd863a6a942ed47789e4fba65f80e66481f138e17f","declaration":"ordered-map-effects","declarationOutcome":{"causes":[],"id":"ordered-map-effects","observationCount":30,"result":"supports"},"harness":[{"path":"semantic_packages/__init__.py","sha256":"ae06adf5d023d88f6380400bd771f3f849934b945c19aff9eb5c5baae7dfd48f"},{"path":"semantic_packages/ordered_map_contract.py","sha256":"60f6c0d01faa544516dddaa7b91e1277a87b7b3aa92d8d5491792164547c7766"},{"path":"semantic_packages/canonical_artifact.py","sha256":"de90cf40f0070b360cf7c149cf6880b29a0d1c32b3f0767e610c68787d2c4144"},{"path":"scripts/record_check.py","sha256":"721c590057f568495a20b58adf39c08d25dddeaa896c4f3f825e5a5719a46edd"},{"path":"schemas/ordered-map-conformance-plan.schema.json","sha256":"d9e61cad21524a13312b86782967e5f14c46bed0c5a0b0888aaa3ea4174289d1"}],"outcomeCanonicalSha256":"c424e9de667971eb37ec164423306d2747d5cba68bea17e5cf2b1a2a7c77690d","plan":{"canonicalSha256":"2cf7b481946ce1c0130e70b0d0ffcc1ec5a58bb10e7963b3f5058253bb63447a","path":"contracts/ordered-map/conformance-plan.json","rawSha256":"bfffbe98114c78c04865bccadc143a02cd46beff71c0f04c0b7f5b522d15c1d3"},"profile":{"path":"registry/ordered-map/theory/dependencies/ordered-map-profile.json","sha256":"6d1297892c355a569e244c2b94448a5f5edaf9b1bf2ae54f940d7c4494fe225f"},"report":{"path":"reports/ordered-map/typescript-campaign-report.json","sha256":"6060adf1c2a3f87ec6ac23f8bdb295f45c866d665686cf5e2fd7ee6f8bcfd358"},"reportCandidate":"ordered-map-typescript","reportPacketRole":"candidate","review":"O-R6d6 PASS; retained report fact independently reproduced three consecutive times.","runner":{"path":"semantic_packages/ordered_map_runner.py","sha256":"9b4729ef5b879821e19926e85c0e4a9db18c81a94e2c28e9215ea28d8b24f28b"},"sources":[{"path":"implementations/ordered-map/typescript/adapter.ts","sha256":"c4a6d37151962df24ce362dd6a3e84cbb1e53045eca780f9d4c37d650579d670"},{"path":"implementations/ordered-map/typescript/ordered_map.ts","sha256":"b2b034ffb23dab1f68eb41c7b42a60a28cbb1b00cb2e96f4c4f4bb9b9efb0697"}],"specification":{"path":"registry/ordered-map/theory/records/ordered-map-spec.json","sha256":"6049d371603cbdac0e722685f1fd25c7369872f7d963ae2e4f4bae90cce7fd7f"},"toolchainCanonicalSha256":"c5a542829d1653c357956574187779a1a2bf9e53c5f7ff6ff71c77a5bb8191ab"},"realization":{"id":"ordered-map-typescript","kind":"realization","version":"0.1.0"},"result":"supports","reviewState":"accepted","scope":"realization","specification":{"id":"ordered-map","kind":"specification","version":"0.1.0"},"version":"0.1.0"}
