{"adapter":{"id":"ordered-map-typescript-json-adapter","version":"0.1.0"},"applicability":{"parameters":{"exitTimeoutSeconds":0.2,"keyDomain":["A","a","B","b","C","c"],"maximumHistory":3,"maximumLiveClasses":3,"observationLimit":3,"responseTimeoutSeconds":0.2,"valueMaximum":2,"valueMinimum":-2},"profiles":[{"id":"ordered-map-deno-sandbox","kind":"realizationProfile","version":"0.1.0"}]},"assumptions":["Reported events are complete for the adapter-observed boundary.","The runner and P-R3a review correctly enforce the recorded checks."],"claim":{"id":"ordered-map-typescript-ordered-map-effects","kind":"claim","version":"0.2.0"},"environment":{"deno":"2.9.2","jsonschema":"4.26.0","python":"3.14.6","referencing":"0.37.0","runnerProtocol":"ordered-map-runner-json-v1","typescript":"6.0.3","v8":"14.9.207.2-rusty"},"exclusions":["Effects outside the adapter-reported invocation boundary are not observed.","No general external-effect, performance, concurrency, remote, or interoperation conclusion."],"freshness":{"producedAt":"2026-07-22T00:00:00Z"},"id":"ordered-map-typescript-ordered-map-effects-conformance","kind":"evidence","mechanism":"bounded-conformance-campaign","method":"P-R3a-reviewed adapter-reported invocation-event campaign for one declaration under the exact plan.","provenance":{"binarySha256":null,"commandsCanonicalSha256":"954fcdcc3c1c636f32adf2b010988e03cc07882c3ffacbb7e4cca5f85f811af0","declaration":"ordered-map-effects","declarationOutcome":{"causes":[],"id":"ordered-map-effects","observationCount":30,"result":"supports"},"harness":[{"path":"semantic_packages/__init__.py","sha256":"ae06adf5d023d88f6380400bd771f3f849934b945c19aff9eb5c5baae7dfd48f"},{"path":"semantic_packages/ordered_map_contract.py","sha256":"60f6c0d01faa544516dddaa7b91e1277a87b7b3aa92d8d5491792164547c7766"},{"path":"semantic_packages/canonical_artifact.py","sha256":"de90cf40f0070b360cf7c149cf6880b29a0d1c32b3f0767e610c68787d2c4144"},{"path":"scripts/record_check.py","sha256":"721c590057f568495a20b58adf39c08d25dddeaa896c4f3f825e5a5719a46edd"},{"path":"scripts/ordered_map_report_check.py","sha256":"1fc0f2b22db7c9a04388cd078ac6f28d8c473c7fcad8c7a9b64f14ca03c8c8da"},{"path":"scripts/ordered_map_profile_choice_report_check.py","sha256":"3d502c52371917a90dbad92ff9315eedd244583e3155ede5a677697f8580575a"},{"path":"schemas/ordered-map-conformance-plan.schema.json","sha256":"d9e61cad21524a13312b86782967e5f14c46bed0c5a0b0888aaa3ea4174289d1"}],"outcomeCanonicalSha256":"45c55df336066cccbd7fde31eb10d3c368d63abcd461defccadfbf95869d4a72","plan":{"canonicalSha256":"57cdeb9d881a272e9c591920cc6bf43d426cbd6310951a99c90797aa91cdb5b4","path":"contracts/ordered-map/profile-choice/deno-conformance-plan.json","rawSha256":"bedd5199c9958ea127c77f4f8646a71a282305b88487854cd2ce4338d76ad0d9"},"profile":{"path":"registry/ordered-map/profile-choice/profiles/records/ordered-map-deno-sandbox.json","sha256":"4629a98d62ae9ab59bebefcab5eab2306eeef8df0b19f80b6cc594f1f5adb1bf"},"report":{"path":"reports/ordered-map/profile-choice/typescript-deno-campaign-report.json","sha256":"ef597eadb9349223d25533b97e490b6ea1463eabf59116924a470ac76ddfe29c"},"reportCandidate":"ordered-map-typescript","reportPacketRole":"profile-choice-candidate","review":"P-R3a and P-R3b PASS; acceptance is bounded to the exact profile-specific report derivation.","runner":{"path":"semantic_packages/ordered_map_runner.py","sha256":"9b4729ef5b879821e19926e85c0e4a9db18c81a94e2c28e9215ea28d8b24f28b"},"sources":[{"path":"implementations/ordered-map/typescript/adapter.ts","sha256":"c4a6d37151962df24ce362dd6a3e84cbb1e53045eca780f9d4c37d650579d670"},{"path":"implementations/ordered-map/typescript/ordered_map.ts","sha256":"b2b034ffb23dab1f68eb41c7b42a60a28cbb1b00cb2e96f4c4f4bb9b9efb0697"}],"specification":{"path":"registry/ordered-map/theory/records/ordered-map-spec.json","sha256":"6049d371603cbdac0e722685f1fd25c7369872f7d963ae2e4f4bae90cce7fd7f"},"toolchainCanonicalSha256":"c5a542829d1653c357956574187779a1a2bf9e53c5f7ff6ff71c77a5bb8191ab"},"realization":{"id":"ordered-map-typescript","kind":"realization","version":"0.2.0"},"result":"supports","reviewState":"accepted","scope":"realization","specification":{"id":"ordered-map","kind":"specification","version":"0.1.0"},"version":"0.2.0"}
